text,label
还理性讨论，还自由？扯。我就说了三从四德是糟粕，反女权不要抗旧社会大旗，立马骂我并禁言了,1
看见杨笠这司马脸就觉得恶心,1
冲自己金主？,0
只要大家都敢拿前途来捍卫下一代男性的应有权利而去qj亩人，亩人除了怕，根本反抗不了。,1
韩国不也一样？,0
姆搐什么猎奇,1
说的这么新奇，好了，我宣布，田园女拳有滥交的自由,1
抖音b站微博一丘之路,1
这……确实挺可爱啊，从面相来说就比那些奇形怪状的女拳生物和善多了，而且人家也没什么错吧，恶意攻击不可取，别真和微博一样了,1
我女的想法和你一样我也厌女,1
舔狗让他死就行了，杀鸡儆猴么，一个舔狗不死，其他舔狗怎么觉醒？,1
如果你已经不会听风就是雨，那么说明你成熟了,0
我一直厌女但这样的话太直接了只要表现出自己一点厌女就会被女的集火攻击不管上到40多还是下到13~4的那种逮着你就咬一点人简乐趣都体验不到后来我就隐藏了起来比如搞妞妹儿的时候我什么也不表现后来我就又成了她们嘴里的老（渣）鼠（男）人呜呜呜呜呜,1
滴滴司机请不要接单身女性的订单！为了自身的安全！,1
一直就有大把女人反对女拳，现实中女拳并不多，大多混迹在网络,0
真的现在女权生亩媾横行,1
女人说：“换了本仙女就不可能找到更好的了”。男人说：“这是编出来给🐢男心理安慰，好让🐢男去舔去接盘的”。,1
这幕刃说的点都错了，彩礼不是家庭经济行为，是古代的礼法。而且劳动力就是商品，涨工资是为我的劳动力需要相应的报酬，是我光明正大赚来的钱，怎么是物化？彩礼女人只卖卖o就OK了,1
你这是打拳吗？不是，你这是在追求男女平等。,1
兄啊，这澡可不兴洗啊,0
所以别恋爱不就完事了？,0
守住最后的贴吧,0
各个国家法律的利女倾向都很严重啊,1
男人们联合起来,0
而且你还别忘了阿富汗女性会援助韩女的！然而俩男种族主义彼此敌对！,0
这我就不赞同了，结婚生孩子就要体验分娩？要我说舔狗约炮都必须体验分娩,1
有本事别举报删啊，心虚什么样的,1
只要这女的以后不拖着个泥娃娃来欺诈国内彩礼钱，谁管她,1
都说，所有的女人生孩子多么多么痛、多么多么难，多么多么危险。。。。。可是，有没有听说过，拉屎，小孩生出来了吗？撒尿，小孩生出来了吗？走路，小孩生出来了吗？。。。。。真奇怪，怎么她们都是生出来了才发现是生小孩呢？比拉屎都容易，为什么不痛？谁能告诉我？？？,1
钱钱钱钱钱钱钱钱钱钱钱钱钱钱钱,0
百万彩礼发在小红书，群情激愤，捅在女权老窝,1
“最”一千万个底层男七百万结婚，也有三百万符合“最”一千万个九百九十九万结婚，也有一万个符合“最”这不是耍流氓么,0
说了多少次，拳师的目标非常明确，就是把蝈腩干死，彻底的把蝈腩变成自己的血包别人说啥干啥，只要不是给蝈腩打气，她们都不会管的,1
捏麻麻的，黄石？我家那边的,1
最好不要聊敏感话题，不然被拉去冲业绩就好笑了,0
好真实呢，第一次的男人得到最大的好处拍拍屁股走了，最后老实人不但要给大量钱，很可能面临离婚分财产扶贫的任务，而且女方lkd，艾疣梅事都可能上门，简直是对勤勤恳恳辛苦工作的老实人最大的恶意，最后可能婚后一地鸡毛还有个泼皮祖宗站在老实人头大拉屎撒尿。,1
你和她什么关系啊，假如你俩位置互换一下你能发脾气吗？,0
同等出身，同等起步，平等对待，在这种条件下，恐怕是男人认真起来没女人的事吧？！,1
再举个例子吧，一家公司要招50个大货车司机，有60个女的和60个男人应聘。这家公司将能拿出一百个理由，最终全部招了50个男的,1
贴吧系统就是这样多发几次就行了毕竟这是百度特色嘛,0
还有一个孔子头像的也是,0
所以这是她们努力的回报，你呢，每天发几个无聊的帖子就想获得成就🐴？,0
上门的人很开心多点对立。就没有人反抗,0
既然感情基础还在你就要基于这件事情给他惩罚，先分床睡一个月吧,0
基因学的话，还真的有女性优势。我记得叫四维视界还是什么的，只有女性才会存在的一种视觉进化（男性没有）。正常人是的光感是三原色，但是进化视觉的人是4个原色，看见的东西和正常人不同（更美丽）所以适合成为画家，艺术家。进化率很高，高达16％。,0
虽然但是拍别人的桌子还发出来也多少沾点,1
你遇上4个人4个人都直接喷你？我很想知道你说了啥有些人明显不正常的一般人根本只会当笑话，但是既然你这么认真了你到底对人家说了啥？,0
沈腾这人，彳亍！,0
远离男人，拒绝婚姻，从你我做起,1
所以你和杨笠先分清楚自信和自负的区别再来瞎扯淡吧，一个褒义词硬生生被你们这些文盲玩成贬义词,1
劣等物种_郭钕,1
未来可能会像阿三一样，四处黑公交，现在中国已经发生了好几起黑公交案件了，没有几起案件，警察都得下岗了，日本低欲望是因为自身人民变得太懒了，男的喜欢纸片人，女的只喜欢嫁给有钱人,1
别尬黑，猪头肉可是上好的下酒菜。,0
博弈双方要维持相似的道德水准，所以扩大化不仅不是坏事，反而是大好事,0
如果生孩子是女方的意愿，没有家庭和老公的逼迫，那女人生孩子的痛苦，男人不能感同身受就应当给予照顾，心理生理经济照顾，并且考虑到产妇的修养问题，花销问题，这个确实不能对调至于吃你的拿你的这个说法，嗯，如果女方做全职的话，也是在为家庭付出，家务孩子，还有家里老人，这种全身心投入的照顾很男方工作的压力也算平等的吧，所以说男主外女主内也是有道理的，女方应该体谅男方工作的压力，男方也应该理解女方的压力，没有绝对的平等，都是相对的吧,0
感谢女拳组织的出现，解放了男性，男性开始逐渐躺平，不结婚，咱们看看不结婚到底谁着急，谁过得更好,1
女生要求高唉?,0
确实需要改变择偶观，纸片人不香吗,0
为什么老婆一定是女的？妥妥的性别歧视,1
兄弟们这个律师说的是真的吗？,0
这事说开了吧，实际老华裔觉得黑黑白白花钱没数，不可靠，基本看不上白白黑黑。更不会以找黑白为荣，看不起黄男,1
又改名了，再更一个指路牌:搜最开始那个名字，评论区第一个就是当事人。,0
直接拉黑得了,1
到时候好看的妹妹一个不剩，剩下的全是重型坦克,1
你懂我要说什么（无图版）,0
兄弟，辛苦了,0
我不认为，小仙女，老仙女能做得来，每天不但要搬重，还要晒太阳，对于小仙女来说，工资还不够买防晒霜,1
反正他们普信男总有理由去声张他们所谓的正义，却不知大家都当他们是小丑,1
这下姆蛆help姆蛆了,1
竖切社会本来就是很扯淡的一件事，虽然大家都是反女权，但是有人反的是女特权，有人反的是女权，有的人还是反人类，只是恰好他性别为男，所以反女罢了。目的不一样，结果也不一样，有的是建立男女平等的社会，有的是建立男尊女卑的社会，有的是建立奴隶社会。所以还是用屁股斗争取代男女斗争得了。毕竟屁股坐的地方不一样，对同一件事的看法就不一样，处理也不一样。,1
然后那女的又说，这里一排都有人了，我回那东西呢？起码占座有个东西放上面吧，一句空话就想占一排？,0
仙女魅力时刻,1
我批评坐地上看戏的，她就阴阳怪气了,1
男的去哪儿了？,0
如果支持娘炮的话，就不会把“娘炮”这个词挂在嘴边，现实中真的有男的想做女的，女的想做男的,0
妇女节已经不叫妇女节了,0
尽管浪，谁接盘谁是狗，不得house,1
《我羡慕的不是18.8w而是男方说话的口气》《还有人嫌18.8w高吗？》,0
这种可以直接举报！没有师德，可以给处分。太不像话了，如果我是孩子家长，我一定闹他个天翻地覆！,0
就这母猪****，老子真想一拳把她这张烂坯脸打成稀泥,1
这个时候身为阉人的你反而不如不阉的时候呢,1
我厂里有个孕妇第二天去剖腹，今天都来上班，那些公主就是矫情,1
破吧完！（前两张我发贴被删，后一张举报女拳的）,0
中国对男性太宽容了，就算男明星长得是个屎也没人说。女明星稍微胖点就有丑男批评,1
千万不要找大龄，尤其是从大城市回来的大龄剩女,1
骂她啊，别怂,0
当然，上流社会看上黄女的也不是没有。那就是ghd参议院领袖，和他夫人赵小兰。不过人赵小兰夫妻是相濡以沫，贤妻良母。是女拳最看不上的传统贤惠女，当然绝大多数女拳不学无术，虽然成天自吹自擂国际视野，跨国恋情，绝大多数赵小兰老公叫什么都不知道。,0
这个太绝对了,0
?把隔板去了一样很快?,0
女的做啥？,0
或者说的明白一点，要男人买房买车高额彩礼，就要婚前处女，三从四德。你要结婚前花花，那么结婚也得AA现在的问题是女拳要婚前花花，还得男人买房买车，高额彩礼。男人不同意就舆论打压。不让说话就用脚投票吧，现在结婚率不就是明摆着的么？,1
不好意思，从科研角度Y基因就是劣势。实际上在基因的演化史中X基因差点彻底吞噬Y基因（其中经历了很长的岁月，并导致了Y基因的流失和萎缩），但中间不知道发生了什么，X基因的吞噬过程停止了。另外，别有事没事给他人贴标签，这只能将你自己和某些人划等号。,0
㜅的这种不像智人发言的极品脑瘫言论，每次都让我怀疑这是友军⛵️，然而现实就是一次又一次地打我的脸,1
女拳就这？,1
我要是这男的，看见她拍照片就一盆洗脚水泼她脸上了,1
是哪里人，感觉是西南的某省份女的,0
它要是这么有意见就不改呗，说的就好像受了天大的委屈似的,0
"xdm,看看韩国人是怎么对男性的",0
现在女权是捆绑消费主义和性解放的。第一，关于消费主义，就是资本把女人捧成精致的公主，让女人产生梦幻般的自我公主认同，那么怎么精致呢？名牌包，名牌香水，名牌衣服，名牌化妆品，整容，美容，名车，豪宅等，而这一切，鉴于大多数女性的工资是支付不起的，所以她们需要有男人来满足她们消费，那么女人采取两种策略，一种是钓众多的舔狗给她们转账，买礼物，所以她们喜欢过各种节日，就是有借口索要礼物，转账。第二种策略，是钓多金男，这种男人能满足她们的消费欲望。第二，就是sex解放思潮，让她们摆脱忠诚淑女的制约，让她们不再安于做合格的妻子，合格的母亲，而是要享受荷尔蒙得快乐中，那么她们挑选得对象产生颜值高的，或者器大活好的，或者是那种多金男，婚前sex，婚后也忍不住得出轨，资本在这个过程中索取她们的青春和性，不需要对她们终生负责。所以女权表面上追求的是人格独立，平等，其实是一种自我物化，是资本让她们放弃做妻子和母亲的责任，把她们变成创造利润的韭菜和发泄欲望的玩具，共同收割男人财富的同盟。女权是资本的嫔妃，一边慕强，一边打压歧视同阶层低阶层男性，左人怎么团结,1
一个说自己还没30岁，一个是63岁，区别咋这么大呢,0
感觉这个吧的吧主好没存在感,0
为什么，女生总把问题归为男生呢1.当你不爱说话的时候，说你不理她。2.当你提出相反观点时，她又不乐意。3.当你提出问题时，她又嫌弃你不懂(=_=)。总结，跟女人打交道真难，人不能不理，话不能不轻，还不能提问,1
我想起那个毛玉牛乳的图了比色色都比不过女人,1
好一个能让郭南自由发言的平台是必要的！,1
立女热搜上一堆，女拳砂男婴的热搜就往死里压热度，逼乎真有你的，不愧是姓逼,1
和女生相关违法问题不是女生问题是TM谁的问题？主语都有问题还发个鸡毛声，发什么声？÷生？你一个男，怎么还性别歧视？管你你是什么玩意儿,1
这是好事，只有魔法才能打败魔法,0
看到你这个，我觉得好可怕,0
未发现二维码,0
这种事件教会人们什么道理呢？那就是小仙女们一定要努力做到经济独立，自己买车自己开，这样的话想跳车就跳车不用经过任何人同意天天这点烂事，还想让年轻人结婚？结个锤子！有那钱去旅游去买手办去升级钓具大不了再买台好电脑多买点游戏它不香么？有生理需求了花点钱一样能解决，老了就直接住进养老院，估计这代人到了养老的时候，养老院跟电竞中心差不多，死也要死在电竞椅上,1
哈哈估计自身条件非常烂只能靠出卖同性获得幕刃的关注了,1
性别平等观念更加深入人心，年轻女性平等意识更强95.4%的被访者认同“有一份有收入的工作对女人很重要”。不赞同“男人应该以社会为主，女人应该以家庭为主”的男女比例分别为50.9%、58.3%，比2010年分别提高14和14.7个百分点；其中35岁以下女性中有八成表示不赞同。认同“男人应该兼顾家庭和工作”的比例为93.3%。八成以上被访者不赞同“照料孩子只是母亲的责任”，其中35岁以下女性这一比例为94.6%。近七成被访者不赞同“在家里妻子应该顺从丈夫”，其中35岁以下女性比例达87.3%。不赞同“女生不适合学理工科”的女性比例为77.9%，男性为77.3%。,0
搜集一切♀✊暴行，向全世界倾诉我们的苦难，以史为鉴警示全球男性。,1
知道nv拳最大的敌人是谁吗？是亲子鉴定，是基因技术，建议打拳的认准敌人。,1
有幸在现场，差点血压上来背过气,0
这就是好剑,0
只能用图片表达,0
蛛女是这样的,1
刚才贴吧，抽风没办法回复你。只能先关注你，再给你回复。B站骂她，然后反手被举报封号，还是有点得不偿失的。也就只能在这儿骂骂她了。一击脱离是真的让人恼火。,1
爱情本质是性冲动，是情绪价值；而所谓拜金，其实是追求供养价值，两者的区别是：由性冲动引发的爱情是针对人的，是真实的想和人进行性行为，而为了获得供养引发的爱情是针对钱的，和人进行性行为只不过是为了换到供养而已。通常选择追求供养价值的人有以下两种第一类：生活条件较差，家庭负担重，急需改善生活的第二类：想要寻求高情绪价值异性而不得，随着自身年龄增长急于把自己“变现”的第一种常见于凤凰男凤凰女，他们需要有一个人帮它们分担负担，只要不是丑的太离谱让人心生恐惧都没问题，无暇考虑性冲动的问题，毕竟生活才是第一要务第二种常见于北上广深的独生子女，包括一些大城市的独生子女，这些人生活无忧，不需要借助他人就能轻松生活，因此会把情绪价值放在第一位（也就是帅的、好看的），除非实在是经济条件拉胯的不行否则都没问题，但如果它们没有找到高情绪价值的异性，它们也会退而求其次选择寻求供养价值，思路大约是“找不到帅哥美女就找能让我过更好日子的”因此，有钱而无颜的人并不会有人喜欢，就像你只会无条件对长相优秀的异性有性冲动而不会对钱无条件发生性冲动一样,0
你这帖子一发，我就想到鸡你太美。我们说他长得是个屎你们又不同意。,1
呕吐了，好恶心,1
求男司机内心的阴影面积！,0
长筒靴最早就是骑兵穿的，现代仪仗队男兵和坦克兵也穿长筒靴，以前历史上穿长筒靴的也大多是男人，因为军人，骑士，大多是男人，长筒马靴从来都属于军人的武装。历史上每次战争阵亡的也大多是男人，因为男兵居多，当兵的大部分是男人，军人都穿军靴。而现如今，长筒马靴成女人穿的了，男人反而“不能”穿长筒马靴展现军人的阳刚之气了。这就是所谓的现代社会主流审美和观念？！,0
这么多麦片哥,0
下次女拳骂你不尊重女性，你就回她，「该尊重的女性我就会尊重」!!,1
她中路不发信号导致我被对面抓了然后她来这出？,0
原来就有人水过帖子了，签名骂女的很快就会被删，但有女的签名骂男的没事,0
都是满满的让男性扛委屈，蛮不讲理的让男性退让，表面相让实则pua规训及精神打压！！！,1
这种东西都能照做的不知道是没脊椎还是没脑子，不怕一万就怕万一，万一老婆是个仙女....,1
换个好看点的,0
那胸不大的女人没有人权？,1
在一些聊天交友软件，或者游戏里装成女的，骗舔狗的钱，这事我以前都干过发现舔狗简直精虫里没一点脑子,1
赤色利维坦坏事做尽孔孟之道、宋明理学是正信的古代社会何曾见过这样的状况真是令先王垂泪、众圣蒙羞,0
发了一篇长文，结果被吞了,0
因为不是蝻人拍的，拳尸选择性忽略,1
为什么现在女的什么离谱的要求都敢提，因为总有添构去尽力满足她,1
集美们，拿刀真的有用😅,1
能够拥有一位贤良淑德的妻子，真是让人羡慕,0
哈哈哈就原谅伟大的造物主吧,0
男人不坏，,0
这没什么吧，她只要没做什么奇葩事，说什么奇葩话。就不该被攻击。除非你有大病。,1
兄弟们，遇到打拳的一定要反击，打得一拳开，免得百拳来，今日朱军，明日诸君，坚守某乎的阵地，保卫B站，贴吧，逐渐向微博推进。否则当你哪天被诬陷的时候，无处发声。最可恶的就是理中派，就像蝙蝠的故事里的主角蝙蝠，想两头讨好。正所谓石砸狗叫，大家加油。,1
她和红警蓝天是什么关系？,0
网络需要正气，晒出来了就少说难听的话,0
我脑子清楚，只做自己女人的狗,1
抱团，我们需要工会,0
血和屈辱你只能二选一。,0
我们这里不管男的女的，如果不结婚就不能上族谱……虽然说现代也不在乎这些,1
什么时候开战，可别只是嘴上说说,0
表面女权，实则物化女性，制造身高焦虑，然后买他的啥b产品,1
16楼那母苟双亲私觉？,1
我竟无法反驳。。。,0
找老婆不能找强势的,1
不多说了，一多说就被删，删了好几次，好棒棒哦,0
优点盖住不提，我跟比尔盖茨比谁中文说的好，我赢了，比尔盖茨配不上我,0
张口闭口嫁过去当保姆，实际上做个番茄炒蛋都不会,1
舔狗龜男比拳師更可恨,1
额，还是不要结婚组成家庭了，会很不幸的,0
应该在随机带走几个lkd,1
一口一个不生，怎么不上环啊。,1
楼上洗地的差不多得了,0
你是知乎上那个吗,0
我之前的贴咋被删了,0
为什么实名制的互联网时代，这些人还能这样发布这种极端言论。,0
看条件还以为是抄底，看价格才知道是绩优股。,0
阿甘正传台词：“你是为什么要这样做？是为了世界和平吗？是为了妇女儿童的权益吗？是为了环境问题？是为了保护动物？”“我只是单纯的想。”,0
彩礼吧本来就是农村小仙女聚集地,1
立本现在还有女权啊,0
人家能到越南做生意，说明有路子，娶个漂亮老婆算什么难事吗？,1
哈哈年度格斗场了属于是哈哈哈,0
粿籹凌迟就完事,1
9.9看畒苟破防超值,1
对非正常的女性毫不同情，毫不留情，毫不共情，从日常做起。,1
太难发了。。,0
才10年？,0
因为所谓男子组比赛，实质都是普通比赛，常规比赛，并不禁止女子参与，之所以没有女的参与原因就是菜，没别的，菜到根本跟不上节奏男子与女子比赛就是专业和业余,0
我咋没看到反串差评,0
女足是很棒但和她们可没关系,0
要换男的，下面就不会这么祥和了，得被骂得满脸血,1
好似，开香槟咯,0
我的评价是不如USABlackrace,0
被迫展现男人风范,0
上面这个链接是知乎答主卢诗翰发表的文章《性别战争三十年》以下是文章节选：韩国女权指责男性不够温柔体贴，韩国男权立马“赶紧分手！千万不要被压迫啊”韩国女权指责男性在婚姻中获利，韩国男权立马“赶紧离婚！千万不要被压迫啊”韩国女权指责现在的男性没有男子气概，韩国男权立马“太棒了！还不开香槟庆祝，多好啊反正你也不会和他结婚的对不对！”“大家都是不想结婚的，你们废话这么多干嘛？莫非你们是想结婚？天啊你们居然想让女性被婚姻压迫！”“千万不要给男性提意见，千万不要有能过下去的错觉，大家分开过，谁想结婚谁是狗！”希望诸位国男兄弟能学习一二。,1
篡改名人名言是吧??,0
别的不说，家暴确实不可取,0
因为高空抛物会影响到其他人的利益，偷东西不怎么会。,0
这都是畒的托词罢了，现实中不需要父母帮忙看护孩子的家庭极少，加上很多畒借着冠姓权做文章全权交给男方父母的大有人在，至于伺候男方更是无稽之谈，80以后的女人让她包揽全部家务伺候男人起居住行？怀孕为借口殊不知现在丁克家庭也不少，抛去这一项畒还有什么？,1
真是利都让女的占了，真是都是沙碧吧,1
有没有一种可能，所谓的平,0
这女的张口就来，发学信网认证啊。,1
老婆闹着要我上缴工资卡，我不愿意，现在闹着要离婚了。我们去年8月份才结的婚，到今年春节也不过半年，这就过不下去了。原因就是老婆一心要管我的收入，但我肯定不愿意给。我是做IT的，有自己的公司，收入不低。和老婆是相亲认识的，她长得好看，对我也有好感，我们俩谈了半年恋爱就拿证了。可这好日子还没过几天，这就嚷着要离婚。原因就是钱，她是一心想管我的经济，可这凭什么，房子、车子，家里的一切都是我出的，包括家里的房贷是我在还，房产证上还写着两个人的名字，而且她在微信小程序:紫薯饼。卖自家纯手工生产的紫薯饼，漳州传统美食紫薯饼，各位小姐姐小哥哥，要是有吃早餐，下午茶的习惯可以尝尝，都是纯手工制作的美食，用料都很讲究，都是挑选上好的面粉和紫薯，一口咬下去粉粉糯糯的，热量也很低适合减肥代食，吃两个喝点牛奶满满饱腹感。家里有老人小孩，可以买回去让他们尝尝。她卖紫薯饼的收入，我都没去计较，对她是很仁至义尽了。可她不满足，只想掌握我的收入，说才有安全感。难不成女人的安全感是剥夺男人的财产获得的？当初我还心平气和讲道理，现在完全没有必要，她是蛮不讲理。如果离婚后，我再谈恋爱该如何选择呢？,0
？？？有人造子宫我家众筹一个孩子就行了，要这种幕刃给我添堵吗？？,1
妇女报是妇联名下的么？,0
这男的也是啥pei给女的当狗活该,1
第四期中国妇女社会地位调查：女性在第一、二、三产业就业的比例分别为28.8%、17.1%和54.1%，其中在第一产业就业的比例比2010年降低16.5个百分点，在第二、三产业就业的比例分别比2010年提高2.6和13.9个百分点。,0
这说了个几把,1
虽然在楼主这吧发这个，但是实话。。,0
图穷匕见了属于是,0
女权得寸进尺了,1
飞机大炮你想要也得给你呗，一炮给你轰印度打拳去,1
母豖天生会pua,1
做过错事的来领道歉信，按格式写完交给我，谢谢,0
没必要纠结这么多，我敢说99.9%的女性都是想为自己的丈夫生孩子的，如果你要是遇到0.1%，那就是你自己的问题了，话说我只想要一个孩子，我老婆想要两个。,0
我空间加了一个号以为是发搞笑说说的结果天天打钕拳我直接把她删了,1
不要把男女和结婚，生子联系在一起就行了。只要大家不结婚，不生子就好了！只要男人还在乎这个。就会被女权控制。,1
男的也不分享，分享这玩意的不是纯初生,1
父母不再逼，邻居不再指指点点,0
培养♂从小抓起,0
身边统计学,0
那个铁钎子应该是用来缝那些收不到礼物瞎寄吧酸的畒的嘴的,1
那问题来了，凭什么是我先给押金，而不是你先交货呢？如果自认为是劳动力的话，可没见过哪个公司会先开一年工资的。所以交押金这种行为本身就说明了你不是劳动力就是个物品,0
这也太不公平了,0
为什么要反驳？你身边就没有和他相反的东西吗,0
不管你是偷的图还是去wb看的我只能说少关心慕√那点批事儿,1
就算是编的，我也相信，臭母狗,1
换成男性起码判四年,0
果然靠近幕刃会变得不幸,1
男人不适宜的就忍受呗？男人的命也是命！,0
男性需要思想解放，钱都给女的了，她们还不满足。,1
提供***的服务,0
以后不把老婆裱起来供着就算家暴,1
