text,label
"不好意思我才回家看到消息。“接受”的意思是？我说的关于“田园女权”的那句话还有举的学会让男生付款的例子就是您那个意思？我是觉得我认识的女性主义者女生中大部分都是坚持机会平等，性别平等，而不是压迫的。相反，压迫是女性主义兴起的原因呀。,您这个类比似乎有点不成立。类比是要站在两者本质属性相似或相同的基础上的，在我的理解中，女性主义的诉求并不是损人不利己的抽烟行为。我觉得归根到底是我们俩对女性主义的理解不一样，也许您可以把一部分口吐芬芳（和一部分到女权主义者一样）的人和基于现实，理论和历史在严肃发出诉求的人区别开。",1
你这话逻辑不对，是蝻犬利用女性去吃其他女性,1
最搞笑的是有些人：我支持女权，但反对田园女权。结果说出来的话跟吊癌放的p差不多。,1
如果真是如女生所述，中间有不少求救和自救的机会，但女生都没有用。,1
"嗯嗯，这个我赞成，我也觉得，如果一个男的蛮牛逼，挣钱多，女的可以很放松，或者在家玩，那么男的一点家务都不沾没问题，如果双方工资差不多，那么必须平摊家务,如果都是一起工作，男的工资高一些，所以少做点家务活我觉得这是应该的，一点问题都没有。但是如果男女工资相差不大，如果都是女的在做家务活的话，那我觉得这个男做的不行。,中年男的不也是靠自己努力？那么为什么就女的难生活，男的不难？",1
"而且我特别想知道 很多男性说 我不反感女权 之反感田园女权。问问他们对平权有什么贡献 只有在极端女权出现的时候 挑刺 嘲讽 反对。真的女性被打或遭受不公平待遇全变哑巴了。所以我特不喜欢平权男。,而且在我认知里 婚驴嘲讽的难道不是内种只要自己""义务""不要自己""权利""，即使被家暴还要麻痹自己是""甜甜的爱情""同时还重男轻女，嘲讽不婚女生的拜吊女吗？虽然她的性别是女，干的确都是向着男人的事，自己跪着，还要女的女的也跪着。,对这不单单是人权 但你看看有多少男的发声了？有多少是叫女权出来的有多少嘲讽女权的？我还想问问女拳不要什么义务了？要求什么特权了？",1
你这句话就是十足的厌女 戴有色眼镜的不是女领导而是你自己,1
厌男直女对所有腩亻平等面对，怎么能叫incel?我们明明是平权派啊,1
感觉所有文案都是，先说一下问题，可是！！！他对我超级好，温柔，给我夹菜，让着我，帮我提东西...套路都一个样，是啊，他对你好，那就去砸钱养啊,1
"天天花着男人的钱还这这创造新词汇男权你可真牛批,你也就这一出了一问男权，就说是我是吧,到现在我也没听到你给我们讲的男权,你也就是在网上喷喷，现实走道都不敢探头自卑，你现实要把你女权的劲拿出来总低啥头,您老应该去国家教育局把男权加上是吧,你们女权天天说自己生活不好没地位，给你们地位了你们能干啥？用你们的女权打到全世界男性是吧,能相出男权这一词您老也是人才呀，是不是庆幸自己是个女的,活在自己想想的世界里不觉得孤单吗，假象有男权是吧,自己假象和男权还说自己不是田园女权,田园女权能连自己都骂说自己妈是驴爸是大鼎的也是奇葩呀,那我们国家大肆宣扬过你们这么田园女权吗，国家要的是女性人群自主自理，你们可好看看你们女权干的啥事,给你们女权地位高了，看看你们女权干的事n绿地集团高管怎么都不说呀，人家可是有钱有地位,也不是我们说三从四德洗衣做饭你们女权会吗？,那我问问你们女权干过啥惊天大事,还甩锅给孔子，还封建社会，那我问问你们女权在福利面前为啥说自己是女性呀不是社会主义社会吗不应该男女平等吗,天天自己也不知道是不是抱个手机天天欧巴欧巴，你家那位要是不陪你看一会就会问你是不是不爱我了是吧大姐,您老也就赚这白菜钱操心国家事,中国五千年的历史被您老一句否决，还嘲讽人家日本女性，好意思说自己不是女权，三从四德流传这么久到您这变成日本文化了,我就想问问男权您老是怎么想的,那你问孔子老人家呗为什么女人要三从四德,我说的是女权你干嘛自己对号入座,连中华人民传承的东西都不认跟我这谈男权,还男权您老给我举个例子呗，让我们男权听听都是h啥,这些不都是你们女权的标准吗？,还男权，您老醒醒吧这里是现实，不是你的公主世界，总觉得自己多么多么重要，地球没你是不能转了还是人类要灭亡呀,我真的想问一句你给我找一条男权的新闻,咋了我们男人不能提女权呗你老授权了呗,那我们谈论田园女权你老对号入座干嘛,天天过节要礼物，还嫌弃自己男朋友没有钱，我寻思你找个有钱人包养你呗，对了有钱人怎么可能看上你这种女权的呢,还要孩子跟女方姓我也没看见你没跟你妈姓呀,年年过节男人给你们送礼物你们女人给男人送过礼物吗？，一问我不是陪着他吗我对他说我爱你了这不是最好的礼物吗？，男人只要不送礼物就是不爱你们了呗,人家国际女权讲的男人能做的我们女人也能做，田园女权男人能做的我们女人为啥要做,还男权我笑了，以前结婚几头牛换个衣服原装的，现在几十万彩礼请个大爷回家呀，一问你们女权干啥了，我给你生孩子了，那孩子不是你的呀，老祖宗的三从四德啥都没学会，在这跟我们说男权呵呵",1
母老虎！她们当成在夸她们管得住老公呢,1
这个博主总是把女权男权放嘴上 忽略事实情况 你刚入职没多久就请假保胎三个月 本来就是错 非要借着女性多么多么不容易把错说成对,1
2就是个失足妇女的心和命，有手有脚的就是不想干正经事当正经人，她就是想做这个，劝不了的。,1
"反基是反动吧女权主义那坨日本女人的论调，再说一遍它们是隶属于百度反动吧西方世界的，连日本之家都把它们叫兄弟，懂吗？村狗！中国自己的女权只有女权之声 新媒体女性 吕频等懂事吗,出口闭口中国的女权贴吧？连女权主义吧是一群日本人建的都不知道,呵呵，同胞？你也不是什么好东西！脑子也不行！天天在网上污蔑中国女性的好像就是你们这种公狗吧，你确定是外国人骂中国女的？还是你这种把不到妹的仇女吊丝在天涯编造出世界公交车这种词侮辱国内女性，有一句评论说的好你这种村 比骂中国女人世界公交车，那外国女不是宇宙公交车了",1
一般的公安机关还不是滋蔓成灾的极端女权的对手，必须中央统一部署，重拳出击。因为她们在中国互联网上已经形成了全国一盘棋，组织严密，斗志昂扬，大肆传播反婚、反育、仇男、仇父、仇母思想，见人就咬，见磁就碰，已经失去理智，近乎歇斯底里的疯狂！,1
"现在年轻男女都好高骛远，父母和家庭如果不施加压力，大多数人的婚姻还真的不容易搞成。,在我的家乡，少数民族的包办婚姻还占到80%，汉族的包办婚姻也占到40%左右，所谓强迫，也就是使用思想上的压力，古代也不是随意打杀子女的。,中国历史上的包办婚姻，也并非完全不征求儿女意见的，现在中国的很多婚姻中，父母和家人的意见仍然占主导地位。",1
在理论形成以前，只考虑具体案例的女权就是这个样子，简单来说就是你弱你有理呗。无关权利平等，只有敌视对面，尽管对面并不清楚有谁。虽然必然经历过这个阶段，但被牺牲的另一部分人就……不配得到权利呗？,1
很简单 因为中国至今仍然是个男权社会 而且已经延续五千年的传统了 虽然这个事实我也很难过我也很无语  。。。。,1
这个女的不是🐔吗 咋还品行正常女孩了 你怕…,1
那天和某男同事说，男权压迫女性，然后他来了句，现在女性地位很高了，我们多难找老婆呀，彩礼都付不起了了。我说你干嘛非结婚呢，你不结婚多省钱啊。他就嘿嘿嘿。某些男的看着蠢头蠢脑得，实际上精着呢,1
"还有我没出去上学的时候，他们很多留守儿童来镇上上学，上到一半不上了，女孩回家嫁人男孩出去打工，我听了就有种怒其不争的感觉，太难受了,确实是农村的更多，现在也是很多，只是态度没那么强硬了，我是皖北县城里的，住在镇上，老家大都很封建，认为女孩没必要读那么多书否则就会眼界高，看不上村里的男人,这不就是物化吗。。。以前的时候女性地位多低啊，现在有人看不惯女权就是因为女生挤占了那些男人们的生存空间，嫉妒了呗",1
"极端都无法形容我们了，我们顶端了已经,啊我们可真是恶毒的女人",1
哈哈哈哈哈真的。我亲眼目睹好几个了，就平里平气的被我取关或者双向了，然后突然出现，妈呀比我还会骂人哈哈哈,1
胡说，一定是你又开除了几万人想自己当女权头子的吧,1
其实不管什么还是从对立面来看都成立的，环境对女性的阻碍或者说歧视，也是女性自身特点的一些对立面，我不敢说博主说的那里错但从对立面看，如果女权运动要有显着进展，女性身上的一些发光发亮的特点也会因此消失，最简单的栗子就是娇柔所以女权的胜利是需要代价的就是女“性”不断向男“性”无限靠近,1
我见过最骚的逻辑还是南拳狗说，女权认为跟父姓是压迫女性从而要求随母姓不就压迫男性了嘛，是在自打脸，不是真平权。关键还是虎扑热评。我全家都震撼了,1
男人为啥不敢打女老板女上司女同事，因为权势较劲要么低要么平，婚女要是能在婚姻里权势比男的高也不会活得那么窝囊废气，想让女权撑腰也不看看女性整体被她们拖累成什么样了。,1
现在她们想要的不是女权 而是特权，并且是真实说出要特权。当屠龙的少女看到恶龙那些抢夺来的金银财宝后 她想的不是屠龙并归还财宝 而是“我也要这些财宝”。屠龙的少女最终没有回来 因为她杀了恶龙后变成了恶龙。,1
欧美男人都觉得给女人拎包是软蛋的代表,1
<username>我觉得还有一点可能是因为她们把不幸归结于婚姻（认为这个是万恶之源谁碰谁是驴），但她们没想过并不是别人所有的婚姻都像她们经历的或理解的一样，这种就是活在自己世界里的极端偏执者，真的不可理喻,1
"如果收了钱你这样说，去带坏微博上得孩子，你良心不会痛吗,可是我男朋友帅，意思争不过就骂呗，你这是丢中国男性的脸，还让男人怎么站起来，为了钱也不能不要脸啊，几毛钱一条，来支付宝打过来,人家女性，意思你就是个男写手喽，抠脚大汉在线太监？,你看我讲逻辑，你只喷，高下立判，挣钱你也动动脑子啊，别堆数量不看质量，你这样你的甲方妈妈可能以后就不用你了,字你都懒得打，就会复制粘贴，你考虑到你甲方妈妈的感受吗，你这乙方也太low了,人家女性看到你这种模样都要绕着你走呢,一口一个不歧视结果说看见女司机就会留意还说男的比女的更擅长？,我没有骂过啊，你看你一直在骂我们，我们跟你心平气和的讲道理，就事儿论事儿啊，我周围一起经常骑摩托跑山的女孩开车开的也很好啊，这个就是个人天赋问题，不是男女问题呀,现在知道以偏概全了？你们以偏概全的时候怎么不放屁？",1
姐姐到处打拳，妹妹明天上学；姐姐忍气吞声，妹妹不能出声。,1
叶家第二代男的有两个狠角色，女的也还行，第三代基本庸才女的更是要情商没情商要智商没智商！基本吃祖上的老本！恶心！,1
你这个才是正确的三观，田园女权都是把婚姻当做交易一样，谁付出的多谁占便宜了谁吃亏了，自己就已经把双方当物品了，然后真正爱情和婚姻不是应该相互付出相互理解的么能斤斤计较到这个地步？你说的身边那些过的幸福的姐妹在她们眼里就是在委曲求全就是叛徒，和她们一样反婚反孕高高在上才是独立,1
"单身挺好。。。两个人都不想顾家 都想赚钱 为什么要去组成家庭 给自己徒增烦恼 一个人他不香吗,只是这已经无法成为主要矛盾了  以前是会死 现在只是没有那么好 但相比普通人已经很好了 都是为了追求物质 高知和非高知又有什么区别 何必单独拎出来讨论,婚姻总是要双方在某些方面互相理解互相妥协 一扇窗户关闭另一扇窗户打开 如果只想开不想关 的确没必要踏进婚姻  这时候婚姻给她们带来的只是痛苦和负担,原始社会婚姻间主要矛盾是雌性为了生存选择婚姻 但现在是21世纪 婚姻间主要矛盾怎么还可能是雌性为了生存选择婚姻  而且高知女性已经不存在生存问题 这一矛盾对她们来说没有任何阻碍 这时她们选择婚姻的原因又是什么 物质方面自己就可以解决 不就应该是精神层面占据主要矛盾了,高知妻子高知丈夫共同承担工作家庭负担 这不是有很多吗吧 更多的学识让他们有更多的见识更包容更易理解彼此 比正常家庭会更幸福  如果某些女性真的优秀到没有男性配的上她 这也是极个别例子 并不会对社会产生很大影响,如此说来 现今社会在你的观点中男强女弱更多 这么多婚姻对他们来说都是拖后腿的无意义的 这么多年了   所产生的社会矛盾好像也对这种现象没有太大的促进作用,没有意义的事情太多太多了 没有意义就不做了吗 而且婚姻只有找一个更有能力更有钱更能照顾人的才有意义吗 其中带来的温暖带来的责任感就一点意义没有吗 人不是没有感情的机器",1
但是拳师们会因为个别男性的行为而去评判所有男性，却不因为个别女性的行为评判所有女性。以为自己就能代表所有女孩子，我怀疑她们幼儿园没毕业,1
哈哈哈，我还不配，但我就像把自己当极端女权，我就是想当没有道德的恶女，,1
男人也可以生孩子，它应该去跪求胚胎然后植入自己的腹腔内膜，当个人造代孕子宫，不然就是白活了一世,1
男人只会受到阶级压迫，女人既会受到阶级压迫也会受到性别压迫。每次女人傻乎乎的跟底层男人团结起来反对阶级压迫成功之后，男人就把女人踹开，自己开始当上等人，又变成之前那一套,1
这截图啊，是一个号称“女权男”的吊子呢！也就这水平了,1
因为他是男的，他就认为，女人是被统治的，连不结婚的能力都没有，仿佛那些婚女，全都是被绑架的呢！,1
女的结了婚啥也决定不了，但她们至少可以决定不结婚,1
"知乎啊。。。带立场的建议通通别看，看纯解答问题的干货就得了,不极端早就完蛋了。我被网上这些蛆生生从温和逼成极端",1
没错，女性群体本来就是弱势群体，很多权益真是一步步争来挣来的，你可以不发声不支持，但是倒打一耙出言讥讽，等有一天属于你的群体权益被侵犯了，那个时候才知道什么叫做兔死狐悲,1
按它的逻辑，它一出生就注定一个都生不出来，注定白活。那它与其活着浪费自然资源，干嘛不早早自杀，腐熟，增肥土地，进入自然循环。,1
受到迫害应该寻求已有法律的保护，而不是放着不用去换取更多的利益。通俗点说，被打了找警察，和网上从未谋面的男同胞发泄是无意义的。打个比方妹子认识我天天聊女孩子真苦女孩子怎么样男孩子应该怎么对女孩子，可是我是连骂女孩子都很少的无辜处男，你让我怎么样弥补女性不是莫名其妙吗？冤有头债有主,1
“国外”也不是那么美好吧，你看欧美的女权组织多少在跪舔伊斯兰……,1
哈哈哈，我也发现了，包括贴吧，女权一直在变化，起码以前有婚内女权，现在大多数是反婚女权了。但是男犬十年如一日，不，千年如一日,1
"哈哈哈哈哈，女人必须结婚，还不许要保证,又骂女人结婚占他们便宜，又见到不婚女就跳脚，也太自相矛盾了叭",1
对啊，简直比我家猫还笨！我家猫好歹跟它说啥它都听得懂！可是屌癌呢，我说了多少次不婚不育保平安，反婚，我微博简介也是独身主义，但是他们经常质问我“凭什么要车要房要彩礼，不负家庭责任”,1
"一加窥探隐私谣言不就是极端女权带的，我尊重女性却被某些摸黑女性的骂，真是狗不过,一加跟别的手机一样，有缺点有优点，我喜欢看那些理性批评的微博和评论。但像这种所谓窥探隐私的谣言，实在让人恶心。放在任何品牌都一样。",1
嗷嗷大叫着生孩子的是母猪真是笑死我了,1
我觉得关联性很大呢。。唐明皇一世英名就毁在杨家人手上了。爱一个人到了极致嘛不就很容易感情用事不识忠奸善恶是非曲直了吗？更何况爱上的又是个女人中的女人，当然沉溺肉欲懒于辨黑白罗,1
男人也是被压迫的 不是他们的口头禅吗,1
停止讨论的话，女权主义者全变二极管思维，才会变得脆弱吧。我反对这个词是因为我观察到大量滥用它攻击个体的例子，包括家暴受害者。语言塑造思维，如果口号导致饭圈风气鉴定纯洁性那套，那这个口号需要被反思。,1
"而且拜托父权才不会因为她们骂lgbt这件事攻击他们，事实上是父权和她们一起痛骂lgbt吧。,集体对外是指父权骂我拳师或者极端女权，我就打拳回去，我不会用“我和她们不是一路人”摘自己。但是即使是女权主义者，有的时候也会做出父权的行为，指出行为又不是否定身份，就事论事不行吗？",1
她和前任之间具体发生了什么网络上的群众并不知道，也只是瞎起哄，男人不在众人面前数落，网上聊骚或者和知己朋友会说很多，没有人能做到完全不抱怨吧。,1
说到底女性都道德感太强咯 也缺乏一点狠劲 反正极端女权越多对我来讲是利好的,1
真的，我今晚就碰见一个这样的男的，我说我只喜欢帅哥，他就说我花痴 臆想症之类的，男人的思维真的都好龌龊恶心，说不过就开始诋毁，太肮脏了,1
"女人被丈夫打死，这是故意杀人。法律条文早就有定夺。正常人也不会同情杀人犯，至于为啥杀人，不管是中国还是西方，司法系统肯定要弄明白的，这对量刑轻重有影响。你就算偷东西，派出所做笔录也得问你为什么偷，法律和社会逃不开这些问题的讨论。这个无关男女，无关东亚，还是欧洲美洲。,你逻辑有问题，女人被丈夫家暴这就是公检法处理的问题，👮不愿意调查处理，和稀泥，就是👮的问题。你为啥要让人家婚姻爱情生活美好的女生上街打砸抢，去攻击男性。你举报公检法，号召大家游行，声讨体制或者执法单位都可，关其他男性屁事，我都没结婚过，也没谈过几次恋爱，然后我就成了加害者？",1
"只能说一个群体的人多了，大家总会有分歧和不同方向。但是男权有极度自私自利者，并且不在少数;女权有那么几个这样的，大家就开始处处喊打喊杀了,（续）让人们觉得“女权”这个团体很过激。其实不是的，也有很多女生是很温柔的，真真正正想让女孩们，女人们有更好的生存环境的。就我个人理解来说，女权是为了让女生们有自己的选择权，不被婚姻、生育等世俗要求绑架，能追求自己的人生价值而诞生的。我自己就是因为了解到女权，现在活的很开心自在。,……怎么说，女权是站在女性共同体的角度，想为所有女性应得的权利斗争。您们在幸福生活的同时，也有很多偏远贫困地区的女性没有基本人权，也有很多城里的女性因为在男权社会长大而不懂得争取自己的基本权利：如冠姓权，继承权。“女权”这个团体的人多了，可能就会有一些人过于偏激，言词过于激烈",1
老有男人问我怎么分手的，我说我太喜欢讲道理，这是真实反馈，说我吵架还123列举说道理很烦。前任也说过“你说的很对这让我更生气”的话，我觉得确是个贬义。一般男性一开始听到就会奇说，我们男的讨厌不讲道理的，讲道理的可是最好的，我都只能回“嗯，你们都是现在这么说”……,1
"多弱智啊？我的天啊？这是人类？我真的高估人类了？原来真的不用太把自己跟动物区别开，这是畜生啊，畜生是中性词。我真无语了。我又能反向认同自己为什么抵触性了。,我们没必要发出“男人在那种状态下也能勃起吗”这种天真朴素的疑问。在那种状态下也能勃起,正是“好!承认你也是个男人”的条件。把女人作为共同的祭品,是男人之间增进连带感的一种仪式。",1
我爸：你就上你的学，我对你没要求。他老人家重男轻女的很,1
我的天呐！！如果是gay就正大光明的爱，这样算什么，变态吗,1
我这个牙医也是 居然给我推销他同学 果然男人都是想着男人啊 精神基佬,1
"是的，大家带点素质上网，女权没市场的，问题就在没素质的人太多，或者装没有素质想要从中间获利的人太多，而且很多人不讲道理。,有些男的脑子简直有坑，你看我微博应该知道我是就事论事的人，为了骂我扣我女权帽子，神经病，大家讲道理好不好，都吃饭说点人话不行吗？女权的市场就是被这种人给激发的，前几年的黑木耳风行一时，我媒体推广的朋友就跟我聊过这个事情，侮辱性质的广泛指代迟早搞对立，现在果然。",1
政府如果真的在乎女性平等权，就会推广男性产假了，而不是延长女性产假,1
你之前不是跟一个女的说不由她定义么，怎么到我这又成了女性自己说了算了？,1
看你说的，四海之内皆你妈？你说现在是父权社会，我也从没想过自己爱怎么样就怎么样，不需要考虑尊重另一方的想法的？既然选择了就要负责，建议你可别去祸害别人的感情了,1
"我觉得借这个契机讨论冠母姓的意义和权力下游无自愿是很有意义的，但是真的不要滥用驴鼎攻击伤害papi酱这个混沌的个体了。她现在就应激了换置顶了更相信自己了，公众没看到关于冠姓权的真正的讨论，没有形成新的群体认知，只记得女权把papi酱羞辱了一顿。,一个女性意识比较懵懂的个体，用爹味骂人攻击她不会加速她的觉醒，会让她坚信自己是自愿的，甚至通过各种手段去说服自己是正确的，会把懵懂的女孩子们也给吓跑了。我们真的应该摆脱爹味了",1
我爸最近也开始变本加厉地逼迫我相亲找对象，还说出不管以后离不离，现在先嫁出去再说的这种话,1
女生在它们眼里只是娱乐的东西罢了,1
哈哈哈哈哈哈哈哈哈你会被骂恶臭屌丝的,1
"您也说了发出来图个乐，yxh发出来，面对的人群是很广的，大家当然有不同的想法。你们觉得甜Ok没问题，楼主和咱们觉得这种行为掉价，也没问题，那能请您代表你们某些人来解释一下为什么冲上来就骂楼主吗？【别拿骂女生的那些男人来挡枪，有眼睛都看得出是你们先冲楼主哈】,？？您脑回路太清奇了，我到底要强调多少遍？这种行为本质就是伸手要钱，您先去百度一下本质的意思吧,妹妹您果然小学没毕业,您可别糊成一团咯，人家楼主没骂女生，你们主动骂别人妹子穷屌丝，提款机是那些男人骂的，我有帮着那些男人说话了？最后一句话你说得好意思不哦？？,楼主说了人家是提款机？倒是你们冲上来一口一个穷屌丝卖相不要太难看,？我可没截只对自己有利的哈，您小学毕业了么？骂女生的我帮着他们说话了？我通篇都在讲你们怎么冲人家楼主，您枪要打在靶子上哦",1
我就是不婚驴子本驴，她们是婚姻公主啦,1
"你不纠结你不在意你跟我杠啥，你不纠结还不让别人纠结？,你们都老优秀了，全中国结婚的不说99%也有90%是入赘的女的了吧？呵呵，整得你们多优秀一样。",1
