text,label
好幸福，喜翻儿喜翻儿,0
话说回来你又能拿同性恋怎么样呢？？有本事就弄死他们啊。几千万个，慢慢来。反正对于你这种以强凌弱的，也就这些本事这种心胸了。,1
不负家庭责任的没有写很多，因为这种很快就离了,0
能不能回复啊，笑死了，没见过这么嘴硬小胆的fw，是不是待会还要自己精神胜利一把说我不屑于和你说话啊,1
吧里这几个反同根本没什么能力，反同还得靠同性恋,1
终于可以说话了，这等级限制，这你们叫的“猪腰”是不是就是骂骂咧咧说要去人家学校堵人家的那个?,1
猪猪挺可爱的,0
复印还得是你们txl厉害，搁知乎上一复制来这一粘贴就把正常人的智商否定了，就那两个赞的文章谁信谁才智商有问题,1
这样的假设，现实中并不存在或极端罕见,0
吧主是重庆的啊，你们那儿也算是重灾区了吧,1
看来同性恋只知道污蔑他人了,1
说的很对。但是吃屎的也不能要吃尿的强行认同吧！,0
你还未染艾身亡？你上药多久了？,1
艾呀，梅事的啦，疣没什么大不了的，中奖几率为淋，痿什么要担心呢，打个疱而已嘛，下次就不药啦,1
说的好，建议直接打砸抢,0
比如在父母面前抽烟的大孝子行为,1
长得丑就活该被变态骚扰 这什么逻辑,1
这样的人一辈子都不会被人看上吧,1
你要的证据来咯。毕竟我们不会乱造谣别人,0
如下，一击脱离是真的给异性恋当成武器了，可怜至极,0
石砸🐶叫了属于是，怎么就不配了？,1
日本为何分区实行，不一起呢,0
看图中这个不是反同的，同恋该时候承认是精神病了,1
反变态吧吧名简洁明了，一看就懂,0
我感觉男同性格残缺或是怪异的可能性很高，和普通人相比。有些人是因为某些事情刺激后天成为男同，然而这类人也容易变得很怪，很极端，甚至很恶心。我指其中部分人,1
饭桶皆深柜，不敢直面自己的内心,1
还得看咋陕西爷基佬死于艾,1
对滴，很多人的头里就是臭鱼烂酱全在他脑子里，不用和他们辩论，因为他们没有思考的部位。🍉,1
说给爷爷听，他们三个什么时候p过你的图？,0
图灵还要什么争议？帮助祖国和世界战胜了法西斯，然后却被自己的祖国迫害，悲剧自杀，图灵是反同碰不得的,0
（仅代表个人观点，不喜勿喷，杠精走开，并无嘲笑和讽刺的意味，如果有哪里语言不当致歉，如果有言论冒犯抱歉，只是单纯的觉得，我家里上有老下有小，请杠精远离，另外我父母还健在，不是孤儿，受过教育，非杠非黑，并无敌意，仅表达字面含义无讽刺、暗示意味，仅代表个人观点并无意引发论战及侵占公共资源，语言不当之处请见谅，本人尊重一切，若本回复冒犯到您我诚挚表示歉意，若您不赞同我的观点不必特地回复我）,0
世界卫生组织周三建议男同性恋者及双性恋男性限制其性伴侣的数量，以避免自身感染猴痘及帮助降低该病毒的传播速度。世卫组织猴痘专家罗莎蒙德·刘易斯表示，男男性行为群体目前有着最高的猴痘病毒感染率。目前的感染案例中，有99%的感染者为男性，这些患者中又有95%发生过男男性行为。,0
我认识的都还好 这种好奇葩,0
先解决孩子安全问题再说吧，基佬炼铜是人尽皆知的,1
“阳刚”之气罢了,1
骗婚什么时候没被抵制了吗，这本来就是个错误的行为啊，但你说的是抵制男同这个群体,1
你们同性恋不包容反同可以拉黑对方龟缩在家里不见人见光就可以了，你们同性恋不需要来这个吧，有拉黑功能可以让你们逃避现实活在自己的世界里。同性恋太丢脸太恶心了一定要拉黑回避正常人。反同是正常的逃不逃避拉不拉黑你们也是正常的但你们同性恋是不正常的不能见人见光所以需要拉黑我们反同才能逃避现实活在自己的世界里。,1
我以前是同性恋后面喝中药调理好了，药方如下:柏子仁二钱半、白蔹二钱、白术三钱半、桂心一钱半、附子一钱。用法:蜜制丸，每日早中晚饭前各服3~5丸(约3~5克)，一律白开水服下，服药期间每晚用热水洗，浸一二分钟更佳，一般服用十天后约可对同性器官感到厌倦，恢复对女性的喜好。,0
还没影响到啊😓，同性才是真爱，异性只为繁衍是谁说的？😓,1
一眼丁真，能不玩这种p图恶搞了吗，整点正能量的,0
就像黄人黑人在美国，他们确确实实弱势，会被歧视,1
而且视频中对其他异性恋企鹅的描述也显示其别有用心,0
这下总结的挺正确的捏,0
异性恋属阳，是正常的，同性恋属阴，是不正常的,1
这个鸡佬，喜欢精神胜利，是一个辣鸡，真是笑死人,1
支持正义执行！txl再不管管，气候变暖又要加重了。,1
您说的有点客观。,0
这问题让我明白为什么基佬在唐山不会被打。基佬染艾原来是为了防身！,1
现在喜欢偷窥南人上厕所，真是从小边台到大。,1
最离谱的是冒着风险跟他媳妇儿pp还生孩子了他是什么nt这跟医院检查有什么关系他在不确定风险的情况下跟媳妇儿pp不就是对他媳妇儿的不尊重吗也没给他媳妇儿当个人啊他媳妇儿不过是个繁衍工具罢了吧不先想想能不能对得起媳妇儿紧着转移话题赶紧离了得了,1
这个鸡佬，喜欢精神胜利，是一个辣鸡,1
同性恋所占人口比例甚至不需要查找专业的文献，百度什么的随便搜搜就有。,0
别人不能定义性少数，那同性恋有什么资格给儿童定义？,1
真的有些腐癌还有喜欢基，雷百合的，还是好看的基，这也太双标了,1
给他脸了，这不110,1
没有基因倾向的人打死都扳不弯的,1
我最后确定我喜欢女生，是因为在我人生的前23年所接受的教育和理念形成了一种思维倾向，小说和电影只是我大脑信息长河中的一只蜉蝣，不足以撼动大树。我说的很明确了，假如我只是一个12.3岁刚刚对这个世界有所了解，三观尚在成长期的少年，日复一日、沉溺于同的作品，或许又是不同的结果,0
直佬日常迫害正常人,1
宇宙畅销反同漫《反同少女泼》改编的反同动画《反同小猪》将于近期开播，依然是邀请银河系反同天王艺人阿泼担任主演。该剧讲述的是一个平凡的反同小学生小猪拯救世界的故事。还等什么呢？快快拿起反同棒，跟随者小猪的步伐一同收集基佬牌吧！,1
作为一个gay，我不觉得这种态度有什么问题啊……这篇回答简单说就是：你爱逼逼你逼逼，关我屁事。,1
他就是一个小孩子,0
我也感觉...其实现在表面上多少人接受同性恋，就是跟风而已，跟风瞎yy别人的人更恶心我觉得，就拿我同学的例子来说，别人以为她是同多少想远离她，哪像网上说那么好听,1
不就是因为觉得自己恶心吗？什么撞号，分出个1啊，0啊的，简直是笑话。自己歧视自己的群体，应该是个垃圾群体吧。你们谈恋爱有多少人能超过三个月？嗯？不肯一起努力，捡现成，摆烂，物质主义，为了金钱抛弃爱情是你们这个群体的永远主旋律，像张国荣，图灵那样优秀的能有几个？恐怕优秀的人才是你们这个群体的少数派吧，不然你们怎么会经常性恋爱，每一段恋爱都逐渐使你们走向孤独终老的最终归宿。哦，我忘了，你们大多数人压根就没有老的机会，这个群体提倡的主要生活方式同样糟糕，你们真的觉得自己能活过五十？好了，我说的应该都是事实吧，死基佬们应该哑口无言了吧。,1
男同喜欢封面上的那种?,1
是的，反感和歧视不一样，我反感毁容的人，看着特别恶心，但是我不歧视毁容的人，我觉得他们和正常人都是平等的人,1
你凭什么假定这位男士的x别？你怎么知道他不是生理上的男x，心理上的女x。照这么说的话，她应该是通讯录才对。,1
不是我逻辑混乱，而是你根本不理解我在说什么。对方说因为做某些事情同性恋居多，所以就应该认为所以同性恋都有很高几率去做这个事情。我用强奸来类比，是说如果这种逻辑成立，那么因为大多数强奸案都是男性做的，那么就应该认为男性也都有很高几率去强奸一样。性取向和某些行为根本就不挂钩，就像性别和强奸也不挂钩一样。无论是强奸还是这个人前边提到的行为，都不是性向和性别的原因造成的，而且其他多重原因导致的，用性向或者性别把整个一个人群全都一棍子打死就是有问题的想法。,0
这人还是个op,1
人与人尊重是最基本的，古代很多书都有说到,0
魔怔人还是要早点拉黑,1
所以那张hiv吧的截图到底是不是真的，你从来都没有正面回应过,0
别自我意识过剩了。别人看你也一样hui气。,1
你怎么确定他们就一定会优先选择代孕这种违法手段呢？难道相比代孕这种违法手段？领养不是更好吗？,0
我不恐同，就是单纯的厌恶，觉得恶心，不为别的，就为txl群体传播x病，还要骗人形婚，毁人一生。运气差一点的，只是被骗婚。运气再差一点，被骗着生个孩子，把孩子也毁了。运气差到爆的，被人骗婚，还被传染上x病，这就是txl群体干的好事。,1
无所谓了，只要开心就好了管那么多干嘛,0
作为正常取向的同性恋。不管异性恋出没出柜，都跟本宫没有任何关系,1
所以你一直看一个中年啤酒肚人字拖大叔和肥胖宽腰垂胸大妈天天搂搂抱抱亲亲的同样恶心吧。所以是个人形象的问题而不是同性的问题啊。,0
冒死字词噜,0
我刚刚看了你的回答 冒昧问一句你老公是什么家庭出生的 我觉得我也忍不了爱情背叛 而且主要是其实你应该当初上个985研究生遇到更好的男人,0
提高同性恋和无子女的养老保险缴纳比例，等其退休后可以有钱养老,0
度度又在刷屏啊，找没找到我是小号的证据啊,0
一一提到视频通话就挂断,0
我会说我不是很喜欢吃榴莲，那些人会说你竟然不喜欢吃，你好过分榴莲多么多么好我多么多么坏他们多么多么正义,0
聊着小淋拿出了女支女名单，邀请阿泼晚上一起去南宁玩捕捉爱的小游戏。,1
同性恋大多是先天的，只是为了生存不得不一开始学会伪装。还有，同性恋也没法传染。异性恋身上也没有同性恋的基因。,0
我们应该联系男权吧，就算大男子主义再怎么样也应该不会支持男同，更别说女同了,1
反正基佬来山东河南河北 只敢学艺术文科,1
从图灵的例子和山羊实验来看，决定性向的基因很可能就不在性染色体上，而是跟其他的染色体性状绑在一起的。,0
我得提醒你一下gay一般即使看上直男也是想被上，不要操那么大的心😅,1
同性恋说跟异性结婚是最对的事,0
老哥，你是真的有这病吗，他们是骗人的吗,0
是的，我是一位专业打击👊同杏恋的职业人士，我每天的工作就是观察👀谁是同杏恋，并且加以记录📝和跟踪，如果出现同杏恋有关的消息我会第一时间冲到现场，对其进行打击👊，打击你们同杏恋就是我生活的全部，我热爱我的工作，如果你们身边有同杏恋请告诉我😡我会狠狠的惩罚他们，谢谢🙏,1
其实不然的，明显反对的还是更多,0
雀食 但这本质应该类似于一种“过敏”,0
你闹你有理，破坏公序良俗的代价，迟早会还回去的,0
据估计，非异性恋人群患焦虑症的的风险是异性恋人群1.5倍，而抑郁症的患病风险大约是其2倍，吸毒的危险是其1.5倍，自杀的风险是异性恋人群的近2.5倍。,0
哈哈啊哈哈哈，世界的笑柄,1
我相信爱情，我也拥有爱情，而且我们双方父母都可以接受,0
男同也会喜欢熊类，男人的身体魅力好不好只有正常的女人才知道,1
跟你一样的想法，感觉这个答主故作清高，自以为是。总以为自己的眼界就是世界，十分狭隘。还来一句骂人无所谓。,0
你没有反对 同性恋 的权利，正如你没有反对 地球是圆的 的权利。,0
来卖凉面那~,0
新的反通讯录十二字方阵挫其锐，解其纷；和其光，同其尘。挫其锐：1、通过言语公鸡来挫伤通讯录的锐气，使其不敢安心出柜。2、使用科学的理论来攻击通讯录的谬论，挫伤通讯录的信心。解其纷：瓦解通讯录纷乱的理论，坚持以下真理。1、通讯录欲望产生的特征是天生的，而欲望产生的对象则是后生的。2、人的欲望并非一开始就那么强烈，而是通过x幻想和自卫不断强化的。和其光：让通讯录自己意识到通讯录的坏处，从而弱化其当通讯录的信心。同其尘：让通讯录意识到自己并没有多特殊，其实自己和他人一样。并帮助他们变回正常人。,1
帅惨惹！无情爆扫下面那个不明生物惹,1
骂人拉黑一气呵成，吃了益达都没你快😓,0
首先我们应该先搞清楚通讯录骗婚的目的。有很多通讯录宣传说同性恋骗婚都是被父母逼的。这根本是错误的。因为现在的经济制度下，社会结婚率每况愈下，都快成为社会问题了。这说明外部的结婚压力已经没有大到必须要骗婚的程度了。这说明通讯录骗婚不是被父母逼的，而是其本身有生殖的欲望，又怎么能说同通讯录骗婚是被父母逼的呢？只要代运没有合法化，通讯录为了其本身的生殖欲望而进行的骗婚就不会停止。而代运作为一种对女性的物化是具有很大的弊端的，怎么可能随便通过？且通讯录是否是正常的，其成因到底是什么都没有一个结果。又怎能随意给其养育孩子的权利？而且即使通讯录是正常的，就拿他们庞大的基数来说哪来那么多人给他们代孕？比起骗婚问题代孕问题更加重要。想通过代孕来解决骗婚不过是从一个小问题变成了一个大问题。与其通过妥协来解决骗婚问题倒不如解决通讯录本身，通过限制通讯录宣传，加强对通讯录的监督，自然能够解决骗婚问题。而不是本末倒置的去允许其获得更大的社会权益，进而增加更多的社会矛盾。,1
恐同怔：恐惧TXL不单单是异X恋者的问题。同X恋者中的恐同者也很多。给药：他们大多受环境影响，因为周围的人都不接受txl，导致他们自己也无法接受自己是txl者，从而非常害怕承认自己的txl身份，伪装成异x恋骗婚以隐藏自己的x取向，有的甚至攻击同类实质完成自虐，现实有诸多例子。如果自己都不能接受自己，甚至因此恐惧与自己相同的人，那么这样的人一生将活在痛苦矛盾挣扎之中。这类恐同者需要增强自己的自信和勇气，不要人云亦云，不要跟风，要有自己的主见。,1
异性恋是掰不弯的，就像同性恋是掰不直的，我们要倡导同性恋和异性恋是平等的，而不是倡导同性恋更好贵，实际上好像也极少数倡导同性恋更好贵,0
最后两张肥猪,1
放肆，本宫乃本吧之主，一切奴婢都该听命于本宫，本宫允许你招人了吗。,1
每一次用手抓沙蚕（青虫），被沙蚕的液体粘手上，第二天马上脱皮，洗手也不行。弄得都不太喜欢用沙蚕钓了。我问过群里的人，有的脱皮有的不脱。发现吧里的人分不清楚青虫与红虫，顺便说一下广东广西沿海地区说的青虫与红虫，（钓淡水所说的红虫是另外一种虫子，与海钓的沙蚕无关。）。两种是不同品种的沙蚕，青虫有两种颜色，青色和红色，但品种都一样，青虫做钓饵，泡几分钟就变软变烂。红虫则是红色的，肉比较结实，做钓饵时耐泡不烂。上图，图一青虫，图二红虫,0
任何事，不要以偏盖全。确实要承认同这个圈子里烂人很多，但不要因此歧视这个圈子里的所有人ok。遇到烂人该骂就骂，遇到正常人希望不要有太多恶意。,1
他倒是聪明，聊天基本只发语音，这样他发的记录大家都看不到他说了什么，私我发转文字后截的图嘻嘻,0
欧美学术界，媒体早就被白左渗透丑了。而且这还是媒体发表的研究报告什么成分不必多说了吧,1
哈哈哈，作为人的最基本权利？给我整笑了,0
非常棒，做好了估计能像安提赫蒙一样出精品,0
很多基佬也弯变直跟异性结婚了，每个基佬跟异性结婚变回正常就没有同性恋出现，世界更美好。基佬反正都需要异性，应该专心治好病传宗接代孝顺父母,1
楼主三观挺正👍️,0
哈哈哈整个吧里就你和楼主在互怼,0
支持同秉承善良与爱无罪,0
变态同性恋，用词精准,1
是同又怎么样？？天天歧视同性恋你还很有脸吗？？以多欺少算什么本事？？😆要不把我们杀了吧？？你有这本事吗？,1
你南异形最需要，遍地人丑心黑还不知丑,1
你所热爱的就是你的生活,0
你们同性恋同婚有什么用。你们就是爱快乐地互相伤害互相传播疾病的怪物。同性伴侣都是短命，因艾滋死了又换另一个伴侣，只会不断离离结结进行没有意义的婚姻,1
同性恋现在才是占据了，舆论的高地，,0
这是被道德绑架绑久了吧😆,0
你们一直拿相貌说事肯定是不对的，现在很多人都看不下去了，人最重要的还是心灵，品德,0
外国是政治正确啊,1
没有同性恋基因的人是不可能被掰弯的，就像同性恋没办法变成异性恋一样,1
让我们回到最初，看看性偏好是如何产生的。生物的最基本的目的在于存在，也就是进化论所说的适者生存，而这离不开繁殖行为。有性生殖物种通过性行为达成繁殖的目的，但是性行为是有能耗的，而生育行为更是成本高昂，从个体的角度来看无疑是不划算的，这也是为何现在生育率低下的原因之一。但是生育又是整个物种存续必不可少的手段之一。那么自然界是如何解决这一矛盾呢？就是通过本能，物种中的每个个体生来都带有不随意志转移的本能。通过性欲这种本能欲望为性交提供奖励，从而提高性行为发生的频率。但这只是第一步，就像前文所说，性行为是有成本的，不能够随意与任何对象发生，必须要有指向。而性欲的指向理所当然是能够与所在个体达成生殖目的的对象种类（性指向），或者说是这种对象种类的外在特征（性偏好）。从这一点可以得出，性偏好是有“正常”、“应然”的方向的，而这肯定不是同性恋、恋物癖、恋兽癖，甚至说是异性恋也不太准确。因为异性恋也包含了乱伦、恋老癖等异常性癖，但至少异性恋是充分条件。总而言之，性欲是进化而来的心理适应器，不应该指向同性。这也是正常性欲与同性恋等性癖存在本质不同的原因。,0
是这群人没有良好的审美，我们反同人士都喜欢秃头油腻大叔，这才叫帅，有男人味。,1
对方有说过，你自己爬文,0
举报就完事了给大家推荐两个国家的举报网站。以后别再说想举报不知道去哪儿了。1.中央网信办(国家互联网信息办公室)违法和不良信息举报中心2.网络违法犯罪举报网站,0
但这种无意识的行为并不代表就是基因决定的啊？,0
他不会平和的和你说话，只会辱骂诬陷，往你身上泼脏水，当你试图和他讲道理的时候，他只会反打你一耙，说你没素质没教养,0
你们基佬要人觉得你们基佬是有素质教养，你们基佬就应该阻止某个基佬让基佬们丢脸的事情否则就是同流合污,1
深柜里的1很多,1
清汤火锅！！加沙茶酱！好吃死了！！就是鲜牛肉。有空一起吃！！我最爱吃了！！１７８　１２２的人，吃到１５０了！！５５５５５,0
你的逻辑思维不太够，第一句在理，第二句就傻了，图灵的行为确实违反了法律，但是处罚图灵的法律根本没有正义可言，所以第二条站不住，第三句更蠢图灵的死，跟迫害有直接关系，逼死了人工智能之父这种过错还能认为他不是被逼的？,0
哈哈你看看自己说的是什么破玩意，先学学语文吧😆,1
其实你说的不现实，因为你看看隔壁的撑同贴吧，不张扬，不lanjiao，不反异，安静平和的同性恋根本不会上贴吧来撑同。换句话说，既然我们本身就是反那些贴吧里的那些撑同，同性恋，那么就和那些极少的同性恋没啥关系了。,1
为什么他始终无法正视自己的取向？如果他真不是gay拿怎么到现在都没发拿出证据？是不想拿吗？还是没有证据为什么空口无凭否认自己是gay？,1
问题是就算在研究所工资也不行啊，制造业平均工资也就比农林鱼牧餐饮旅游这些强上一丢丢，金融的一半不到，互联网的2/3没有行业报告里都写着的。,0
被我们关爱得气急败坏，最后只有把头蒙上,0
广西最少，win,0
基佬只是不搞女人的渣男，除非他不渣；但基佬不渣还能是基佬吗？尤其是骗婚的。,1
在反同群不反同，你自己也说过你是双性恋了，所以要为民除害找你很合理。,1
这有什么好骂的呢？不过骂完删评，然后拉黑罢了。🤭,0
介个QAQ 我不想移民 第一是我爱中国 我相信中国会改变的！第二是 - - 我没钱啊亲爱的,0
强求别人接受自己的观点、和自己不一样的观点肯定不存在，这个和同性恋其实没什么关系。这叫狭隘。,0
萝莉与正太同时穿上女装。你们就会惊呼多么纯洁可爱的两个女孩子啊！偶然小正太更漂亮可爱一些。人群浑然不知的更靠向小正太但当人们得知最漂亮的小女孩是男的之后他们就瞬间对他不感兴趣并在背后议论着没想到他竟然是个男的！我靠，伪娘真恶心小正太并不知道为什么人们对他的恶意那么大或许这就是男性的命运。男性不能去追求美的东西。不能变得可爱必须把尾巴藏在阴暗处。并且分类为伪娘跨性别的标签。小正太觉得自己并不是伪娘或跨性别者因为他只不过是在追求美可是医生会告诉他你就是性别障碍有女装癖。家长们会告诉他男人要有个男人样。同学们会排挤他于是他开始厌恶自己。厌恶自己的性别，厌恶自己的生殖器官。他把生殖器官视为上天给他枷锁他改变不了什么因为总有一些人知道他是男的之后就对他打上了肮脏下流性男的都一样的标签仿佛男性犯了滔天大罪或许吧。小正太剪去了他的长发脱下的只有古代男性才会穿的长裙他想不明白就算他明白了，他也无法让世人明白,1
当然，为啥你觉得哥不直啊😊,0
这个基佬人面兽心还叫帅天理何在！,1
你要坚持自己的想法，因为我也觉得同性恋很恶心，永远都不可能改变，太恶心了,1
所以说到底他不还是个大猪0吗失足我都想象出来那个画面了他艮个脖儿在那🔒,1
我感觉你了解，我感觉写那些的人也不理解，真正可以研究同性恋是什么的原因应该是当事人去研究更好，一个正常取向的人是无法去研究同性者的存在，就好比你相信人有灵魂的说法一样啊。同性者就好比一个身体和灵魂不匹配。他们也是不幸的，比如男同性我猜也不是见一个喜欢一个，应该就和正常人去喜欢一个人一样有感觉的吧。,0
我感觉我会在乎对方的能力 品性 学识 刚好的外貌,0
毕竟同性是真“艾”,1
满口空话从来不拿出证据。除了意淫就是意淫,0
只要不给斜玉玄枢的马甲权利，本吧怎么都能建设好,0
你什么意思,0
综上所述，以后想起来会补充，同性恋就纯纯懦夫,1
谁都能有自己的想法。我也更不会说什么txl才是真爱异性只为了繁殖。,1
我相信时间会改变一切，并且可能朝着两个方向发展要么，国民受教育程度变高，新生一代对多元文化更加包容要么，国民道德水平普遍降低，对滥交等行为的忍受度上升（譬如，未来医学在艾滋病领域取得突破性进展）值得一提的是，两者并不会完全分离，反而是会同时存在的可能性更大。,0
当然有了，但是大多数都有自知之明的。别人还没喜欢你的，你就自作主张的以为别人喜欢你，我该怎么称呼这样的行为呢？,0
小丑能出来说一说你的成分吗,1
emmm 百度说的就一定对吗🤔,0
谁又不想长寿呢,0
我国2018年的书看看同性恋是不是要治疗。,0
说不好啊。。。。,0
于是泼峰和战淋唠起了嗑。,1
人家说的是生理上而不是理性。,0
笑死了后面还有在发阴阳贴的说什么不敢出来见人我挺好奇的那这种寻衅滋事的跟警察见面好吧不都喜欢拉人吗？笑死,1
