text,label
"重新思考，可能还有就是在我这里爱情反而是……摆不上台面的,不过搞cp的时候这些东西仅限二次元啊，我恐三次元男性包括异性恋同性恋，我都恐，对三次元兄弟情深无感，真的不比任何东西高贵，放到二次元的话我这里兄弟情>爱情，所以说次元差真的很大,还有很多东西，我自己很清楚我的这德行，像搞cp的时候，我那一套我本命必不能作受是很明显的男尊思想产物，太明显了，还有像当受是委屈，都是,我脑内有很传统的一套男女观念，然而当这用在我自己身上时又会使我感到极端不适，所以我去寻求所谓的平权，但我本质里还是用着那一套很传统的男女观念，男人赚钱女人养家，生儿育女，不能露出点多余的皮肤，不能怎么怎么，我真是这样的，说起来还真是讽刺,虽然我高中一度说着男性能做的女性也能，对一切不平等的看待非常不满，但实际上这种情况只是因为我不是男性而已。这个想法是以男性是上层阶级，而女性是下层阶级为底层建筑的，若我不是弱势方我怎么可能会去争取“平权”呢？哈",0
我真的给身边每个女性朋友安利止疼药了，它真的能救命啊。不让我吃的人都被我骂的狗血淋头,0
甜茶的气质真不适合这个角色，一点没有new Yorker的味道。,0
唉被洗脑蹭热度的一堆！女孩子嘛我也不知道怎么说！我感觉现在女孩子的地位已经很高了！比男生的地位普遍的高！至于那些少数有权有钱的！你就普普通通一个人干嘛要天天跟这个比那个比！以前讲人人平等！后来讲女士优先！既然女权要平权！那就别有特权！既想优待又想踩踏跟不可取！还有营销号一堆！,0
不是他儿子都说他那什么吗 如果那样被骂也不冤 只是不必封杀他,0
微博有些文章还是不错的，虽然好多有趣的博主都炸号了!,0
即使我不同意你的观点，我也会捍卫你说话的权利。毕竟一个健康的社会里，不应该只有一种声音。,0
右边，建议了解一下为什么会叫驴？驴的这个话语建构是什么，它试图解构的是什么//,0
怎么说呢 聪明人都懂得扬长避短以及用做成的事到达的成果说话 个体差异远远大过群体差异,0
姐妹，革命队伍里无脑极端分子是必然存在的，不能一味的否定他们。具体可以参考义和团，赤农这一类。我觉得极端是一定要经历的，一方面可以给自己人一些提醒，一方面也可以给对手一些警示。,0
哪个小可爱能安慰安慰我，寒假本来想打拳来着，现在有病毒，家长不让出门,0
我前天就看到虎扑陆陆续续有发踮质疑他，后来就遇到反对意见就扣帽子。jrs们素质这么低真挺失望的,0
以前我真的有点厌女思想。现在？我厌男。,0
哈哈哈  我也是  我遇到妹子跟我撒娇我就立刻阵亡    要啥都行,0
"国家福利影响的是孤儿院的条件，不是领养家庭的条件，这点能不能拎清楚？我没说不支持堕胎啊，我是看你不了解孤儿院情况所以来科普一下，怎么被莫名扣锅了,强奸弃婴能有多少有先天疾病，没病送到福利院马上就能被领走，比起被被不爱他的母亲打骂一辈子，到底哪个伤痛大不是你一张嘴决定的。 领养条件苛刻是为什么你不想想啊，因为供不应求啊，傻孩子,孤儿院里没残疾没先天疾病的孩子，多少人排队抢着领养呢好吗？我还想问问你“了解过吗”呢",0
支持色情小说的什么恩和元元，有什么脸面谈女权,0
这个类比也太离谱儿了，移民多难啊，没钱没本事办不到；不婚多容易啊，躺着就成了,0
和男同学说强奸男人不入刑他都吓傻了,0
说我极端，怎么我是杀人埋母了还是堕男胎了啊,0
赶紧去youtube取关了她，真是的，她自己暗搓搓倒贴就算了，还跪出优越感来了，何必呢,0
之前关注足球用的懂球帝，后面太多臭水沟的了，就转去虎扑，结果发现一样的环境。   现在知乎环境也有这样情况，搞不懂...,0
"嗯，这就变成零和游戏了。结果肯定双方受伤，只是受伤害多少的问题,是的，我也是看得对人性更失望了。单纯的发泄和攻击，抓紧给自己带流量。真的是没救了。",0
可怕。逼迫艺人 和 艺人认同下 的拍摄是两个概念。一个人可以不是圣人，但怎能是个恶人？水原能对荒木经惟提出这个抗议性质疑真的很强。//,0
听到我去读书还一副嫌弃的表情。一个男的忽然跑过来跟我说，你上课坐前排挺....（一副嫌弃的表情）。妈蛋不坐前排怎么听老师讲课？不听老师讲课怎么拿高GPA，怎么跟老师沟通，可以去实验室打下手，参加下科技竞赛？,0
哈哈哈哈 夏天不仅是个活泼开朗的孩子 还是最惹人爱的,0
"只重视自己的事业，不重视自己的伴侣，的确很容易失去自己的伴侣。你都不重视对方了，为什么你要要求对方一直重视你？ 当然你又会说这不是王出轨的理由，这肯定不是他出轨的理由，说老实话，他还真没想过出轨，那不过是个意外，但这个意外是谁给的？不是安娜自己给的吗？,再次提醒你，王没有一边睡着一个女的一边安抚另外一个女的，除了第一次意外，他没有和任何一个女人睡。在渣不渣这个问题上，你作为理想主义和绝对主义者，肯定只有渣或者不渣这两个结果。举个例子，偷2000块钱和偷两万块钱和偷2000万块钱，法律判他们的结果是一样的吗？,并且在爱情的领域里面，付出是双方的，一方不停付出，一方只知道享受，这种不平衡，早晚会让双方散掉。当然你又会说，这并不是王出轨的理由，可是你看清楚了吗？他出轨是他愿意的吗？他故意的吗？他刻意的吗？都是意外，既然是意外，你怎么能说他太渣？,又想事业，又想得到好的男人陪伴，世界上有这种两全其美的事吗？有得必有失，只有理想主义者的心里才会有你这些想法。这套理论不只是女人，男人一样适用。人无完人，生活就是生活，没有理想主义。",0
我看到“杀掉一部分男的就好了”——1000赞我就觉得肯定很多人出问题了,0
这次的名字其实连女权都没带，是国内一批人给按上去的。直译就是“女性游行”，根本没有统一的女权诉求，就只有一个共同的口号说宣言妇女权力。,0
这没有政治正确的说法啊，因为没人会说自己支持或者不支持异性伴侣结婚，那是默认的人权,0
房思琪做错了什么要跟她放在一起对比,0
喔，又是体力论?默认所有男性体力高于所有女性体力?如果外科需要体力?为什么不直接把体力作为招聘标准?而是把性别作为标准?体力可以锻炼，性别怎么改?做变性手术吗？,0
炮哥你考虑开个外语班？语种的话就选您比较熟悉的祖安语。我想报名,0
"对啊，只要是自己想要走的路，就是对的路！并不是不生孩子才是对自己身体的掌控,女权不是女性性别优越 是男女平权",0
我同学里边就有这样的，我们班都没有什么感觉。。随谁姓不一样，这个鄙视我真的。。。,0
干嘛要自卑   我遇到身材好  长得好的女生就像和她们做朋友   每天和香香软软的女孩子在一起太开心啦！,0
........好好看看理解理解我说的行吗.我不是又解释了一下我的意思吗.......你这回复的和我说的意思一样吗？再说？俩儿子说的就是真的前妻说的就是假的了？ 还没确定吧？,0
脸皮真的是个神奇的东西，因为它可大可小、可薄可厚，对于有些人来说甚至可有可无,0
希望不会有中国版metoo 举报 赞[67] 回复 2018-03-09 16:40:27 来自网页,0
"可惜这只是个民事诉讼，如果是涉及国家安全言论的，网警就会查出实际使用人到底是谁,如果实际运行不是高莹本人，法庭会继续调查的，因为实际侵权人错了整个判决就错了，而且高莹作为被告也没有对自己不是这个号实际运营者进行过任何抗辩，至少说明她自认或者同伙",0
法官不但判Allen败诉，还在判决书里说Woody Allen的行为严重不适当，要求采取措施保护Dylan；检察官也公开说明不起诉的原因不是罪证不足，而是怕二度伤害儿童。Allen团队提出的不在场证词和评估报告，则被法官、检察官甚至警方判定不可采信。,0
"对，用于人民，你代表多少人民呢？这条法律多少人反对呢多少人支持呢？你统计过吗？张口就来基于现实，现实中的大多数没时间跟你在微博上对话都在闷头挣钱呢。你能代表多少人就张口闭口谈人民了？立法本意针对的是什么都没搞清楚就来喷，你如果是学法律的，我建议你回炉重造别出来害人,呵呵，跟我谈法律实践？离婚冷静期的前提是什么？是双方达成协议，起诉离婚的前提是什么？无法协议离婚。任何不提前提就谈结论的都是耍流氓。",0
哈哈被大大这么一提醒，发现自己多了好多优点[嘿哈][嘿哈],0
这不是个要持续恐惧和自我压抑的时代 车轮总要往前走,0
这应该不是性丑闻吧，这是刑事犯罪，性丑闻一般指的应该是affair之类的，但还是consensual sex,0
我一开始只看这个图，我感觉也没啥。你看我上面的话嘛…如果十几年就因为这个手，然后啥也不干，轻钝器都不拿，我觉得这个人不管男女都不太行哦…,0
“女人的不幸在于被几乎不可抗拒的诱惑包围着，每一种事物都在诱惑她走容易走的道路，她不是被要求奋发向上，走自己的路，而是听说只要滑下去就可以到达极乐的天堂，当她发觉自己被海市蜃楼愚弄时已经为时已晚，她的力量在失败的冒险中已被耗尽。” ——西蒙娜·德·波伏娃,0
我觉得你两可能是同一个观点但是TA没看懂你之前讲了什么,0
我追星我不厌女！我爱美女们！也爱帅哥！,0
上一条有说，她姑姑抚养过她，而且姑姑无儿无女,0
嗯嗯，我知道这个事！但都四月份的事了！就是觉得怎么现在被约谈还封热搜呢……,0
难道不是拍了照合同不公平 没有相应的报酬以及照片她没有话语权等等问题吗 升级之后也是荒木的男尊女卑观念 弱小者要学会保护自己吗？关脱衣服什么事？,0
我的母亲就以羞辱和嘲笑我为乐，我现在跟本不理她。,0
20多岁的脑子很多都很简单的，我20岁的时候还相信爱情呢，见多识广了想法就不同了，所以男人喜欢年纪小的，说得好听单纯，说得难听就是蠢呗,0
当有更多的男性关注你，那时我才会觉得这个社会是真的在进步，关注你我觉得很幸运,0
"我没有说有人恨，我是说真正的女权不是恨男人懂了吗？,幸存者概念，意思是每个女性都被男性欺负了？,你在说什么呀，你意思是女性就该恨男人是吧？",0
可以去跟小区物业沟通一下，让他们帮忙在业主群发布一下寻物消息,0
有句老话什么嘞，自古嫦娥爱少年。封建的古人都知道女人也爱年轻漂亮的男人,0
娱乐圈本来就很乱，韩国娱乐圈更是如此，爆出的丑闻太多了,0
我无比认同朱迪法官关于“为什么我不是女权主义者”的观点,0
我，转发机器。曾经也差点儿偏激到Against Beauty的路上去了，好在美还是可以给自己愉悦享受，又拉了回来。,0
网上更多的声音是讨伐那个凶手：得不到就要毁掉的 这种变态心理。更多的声音是女孩们最近真的很不太平，青天白日还应该如何保护自己。你说的女权也别以偏概全我们全部网友吧,0
不转微博没错，转了就该夸，听懂了吗？被打回去的援手多了就再也没有人愿意热脸贴冷屁股了。,0
我只想说终于反击了，想不明白德普被打压了那么久为什么一直不吭声。至于迪士尼，那就再见吧～没有德普的加勒比我也没有兴趣,0
有什么的 原来有的军队还专门找同性恋 因为恋人如果战死 另一份会疯掉 能弄死好多敌人 这有啥 古代人都很包容断袖 现在就不包容了,0
嘻嘻嘻嘻还真关心我们家爱豆不知道是哪家的开个小号到处黑,0
单身狗：第二杯半价对我们太不友好了       单身猪：单身狗就是事多，我们单身猪就没有这个问题，我们一个人就可以喝两杯,0
其实大魔王那期最毁的是VAVA，简直毁宋岳庭的神作,0
不同意，首先男性主义为什么一定是保守的？女权可以分流派，为什么男权就不能分流派？,0
"我真要说你莎比了，磕巴，你听说过没，你马不仅斜眼，又磕巴，都是病名，没有贬义,斜眼又不是贬义词，你发这么大火干什么呢？又没骂你莎比～",0
？不是杠，我觉得说的巨对，但看报道，她妈妈没有要摆脱负担啊？知道女儿被害也一直在照顾女儿，找警察啥的。是被鲍毓明骗（保证让女儿考上名牌大学），会让爷爷奶奶照顾星星，母女通话他也监视啊,0
就是看完心里有一种说不明白的感觉，很难过，心酸，愤怒，无力都有，也不知道怎么办，现在能想到的就是一定要保护好自己吧,0
天下娱乐圈一般黑，国外也流行诽谤前夫引导大众舆论啊，可以加入我们国内背锅前夫三人组了,0
非要是造成侵害才能被关注吗？很多时候，女孩真的是不受保护：被调戏、被骚扰、被猥亵……在某个角落，或许正有某个姑娘恐惧地哭泣，但她们不敢说。 那些杀死受害者的不仅仅是性侵，更是这个社会对性侵的态度。如果法律不能健全，为何不能让舆论对伪君子们有所“报复”。,0
说实话，这不是秘密，绝大部分人都知道，只不过为了撇清装自己不知罢了,0
人类靠奴役其它动物获取了肉蛋奶、毛绒、皮革、肥料、耕力、运力、战力等不计其数的财富，对于智力相同体力相差无几只因孕育而示弱的同类，同样可挟其要害榨取油水，获利远超想象。,0
可以，不过瓶子你这样说是不会有女粉的！,0
我有天玩电脑突然怀旧一下登上了QQ农场，结果头像还是他。。。我找了半个小时怎么换没找到。气死我了,0
异性青春小说不是女性写的吗，那也不是异性恋生活，你还是活在小说里，因为你的现实世界一点都不好，你没有走出来,0
Me Too从演艺圏扫到了文艺界，接下来就是政治界了，莫怪要连爆一些绯闻来転移,0
游戏输赢看的这么重要还要逞一时之气又幼稚又可笑，不要把情绪浪费在这样的人身上,0
如果是强奸、殴打，五亿都应该；如果不是强奸，一分钱也不该付。绝不是站哪边队，凡事应该名正言顺。,0
女权和平权一样的话，我支持，女权和特权一样的话，那就要单独聊一聊了,0
马蓉生了两个孩子啊，女人生孩子可是鬼门关走一遭，这些付出为什么不被认同？说孩子不是王宝强的，儿子不好说至少女儿绝对是啊长得一模一样,0
ins下被点蜡烛被p遗照的时候你们没看见 为什么不可以在一首本来就是diss曲里反驳黑子？ 更何况这个单词并不是直译的意思而是混蛋畜生的意思....,0
我女拳第一个不服，哈莉奎茵冠名小丑 女，就不是独立女性了！还没结婚呢岂有此理！,0
我还能看她微博，证明她没有拉黑我。而且说我是男人，我明明说了性别保密不说的吗？,0
那些所谓的“女权”的三观崩坏到让人怀疑这是正常人说话吗，像传销那样恐怖。,0
国内不也是吗，为啥敏感？没有点哪来的敏感？还不是压迫的时间长，解放的时间短，况且回潮和倒退也不是没有先例,0
很多被性侵的女孩都会这样的，因为被社会贞操观束缚，不愿接受自己被强奸的事实。,0
对啊，就是说啊，你家这位女士天天炒作，烦不烦，有时间这位俊杰啊还是要多劝这点，要知道多行不义必自毙，万望小心为好。,0
你们可以在自己的婚姻中争冠姓权，有啥资格去指责别人的婚姻的选择了，全世界都要跟母姓才行，跟父姓和母姓都是正常的事情，自己去选择就行，与其他人有啥关系,0
看到你老师毫无内在逻辑的言论，我觉得可以不用问么理她。,0
关注了ayawawa一段时间，梦蒙我关注的少些，现在我连one都不怎么看了,0
"http://t.cn/EwWpxx2  这个博主就是当时那个彩虹头像的设计者…结果现在一群人用完就扔，还有脸让那些博主换头像,http://t.cn/EaG2hSr  四月份被反咬之后整理的时间线",0
不是当事人，也不知道事情的真相，但大导演这样回踩一个刚出头的小演员也太难看了,0
为什么不把阴阳性当作一种文化看待呢？我们吃饭用右手难道是歧视左撇子，搞不懂,0
擦，川普还说过谁，赶紧自己先滚了得了,0
看有评论说不可撒谎 然而世界本是罗生门 或者是蚂蚁窥象 看得明白吗。保持怀疑，保持怜悯，保持善良。,0
自上世纪60年代以来，美国社会发生的“最快文化转变”。,0
再会看人也不可能从第一面完全看明白的，一个人在不同情况下做不同事的反应也不同，这不能说明你不会看人，反而证明了你越来越知道如何去看一个人了，这不是挺好的嘛,0
what？感觉你根本没懂我在说什么？是搜女权主义搜出来的吗？,0
单纯的讲，科比那奖拿得有点儿……呵呵，也许是美国人对他的情怀吧。,0
我之前也是 想要主动和那个人亲近 因为感觉好像自己也会变得正常一点 好像自己不会那么难受。现在看看自己真的是蠢和可怜,0
强东和京东对权力以及女人都有一定的误解,0
没必要跟人家扯这么多的兄弟人家天天混微博抖机灵杠精男权女权平权用的得心应手 活在自己世界里听不得这些的,0
每一个字看的我很心痛难过，女孩，未来该如何重新活。,0
可是猥亵哪怕证据充分 不过是个拘留七日的结果 又让人如何心安 这场运动不进行 法律永远是那样（毕竟之前没有在网络产生舆论时 性侵还是很多吧 没见过大力度改进 为什么性侵之事如此广泛 难道犯罪成本过低不是缘由之一？,0
女性在公共场合穿着过于暴露构成猥亵，依法行政拘留15日,0
"说实话我听不懂你要表达什么，可能因为年代年龄的差距吧。微博的作用就是让民众来探讨一个事件，各抒己见。而不是谁说什么，就出来个杠精说你有本事你去改变世界。微博的好处是让我们了解了世界。我可能改变不了世界，但是希望我们了解周围发生的事件后，努力不让世界所改变。,这种东西不是各人举报的。棒子的媒体和政府是分开的，不受政府监督？所以韩国才会通过新闻和栏目揭露很多真相。中国大部分新闻都是被和谐的，这是国家政治区别。国情不同。你见过国内哪个节目不通过国家审核就可以在节目中直接揭露丑行的？",0
上次在别的博主那到一个小姑娘投稿，一直关系很好的亲姑姑拒绝给她捐骨髓，评论底下都是骂小女孩的,0
一听到男人絮叨自己的公狗天性就尼玛烦,0
很多时候，都会被说的哑口无言，无奈又残酷的真相，因为我就是那个口中本身并不怎么样的人，那我该怎么做呢,0
你说的挺对的，而且如果有一个人姓氏不好听，也可以跟着另一方姓呀。日本还有夫妇同姓，意思是结婚了女性加入男性的家庭，男性把自己宝贵的姓氏给予女性。有感情就行了，也没必要这么在意形式,0
一看你就没有走过法律程序，不知道不了解可以选择不说，但是不要带节奏，崔没有想让你知道。抱歉可能我说的话有点过激了,0
是的  reputation不存在的   这张专是甜蜜爱巢自娱自乐了吧,0
"我热门微博里的两条链接下总共有五十多条源自外网的证据你瞎了？我怕你不去看，我还给你直接发了那么多条大段大段的解释你瞎了？我们连艾梅柏家暴前女友的法院庭审录音和警方提供的被捕记录都贴出来了，你说我们是编的？笑死我了，造谣造得连法院和警方都不相信了吗？,看吧，这就是女方粉丝的素质，没有证据只会骂人,给你看看一位加州法律从业者的原话👉“单说法律文件里的admitted and averred这句话，确实是女方承认，不过是开庭前。开庭之前双方都能提交名叫interrogatories的文件，指明对方回答文件上的叙述内容是真是假，若对方承认为真，则当作事实处理，不在法庭上辩论。”你们这帮法盲,女方粉丝从来不敢把事件全程梳理一遍，只会拿男方的证据断章取义歪曲，而我们收集这么多外网资料，甚至放了外网的全面扒皮贴，可你们就是不看，就只看女方一面之词，我们连艾梅柏家暴前女友的法院庭审录音和警方提供的被捕记录都贴出来了你们有吗？就在我微博热门第一贴的第二条链接的评论里你敢看吗？,你看清楚文件里写的是被艾梅柏承认的意思好吗？完整文件包含艾梅柏承认家暴前夫和警方到场时没有发现艾女士受伤痕迹的证词，链接请去我刚发的博主热门最高那条下方评论自取，我发文件链接会被屏蔽,文书画红线的averred是法律证明属实的意思，并不是什么单方面的证据，这就是艾梅柏承认家暴的结果。你说的判决问题可以去我刚给你发的主页搜“结案文件”和“家暴不成立”，都已经翻译好了你自己去读读行吧,我不说了吗？你看我微博就知道了，她承认了家暴",0
看到这个，我想到的是德普的律师这一单能挣多少钱啊？,0
又来了  你用你的小脑子读懂这段话了吗？  我都不想支教了。。。。。,0
…………天真，现在公司化运营微博号谁不是一个皮下好几个人，出了事还得开个会商量一下发微博的措辞,0
可能是学了个新词想出来炫炫但是理解能力还不足以让他明白这个意思。（大部分都是）,0
对于当下现状来说，全球女性集结在同一个活动上，就已经是一种进步。虽然要换取平等和认可，还需要许许多多这种进步，但，它在进步。,0
看了他五年来的微博，我相信他开始只不过是反对极端女权，但是他底下的粉丝……感觉有在影响他，他发关于围棋的微博也越来越少了……,0
我不是说她不够精明，我只是觉得应该把她态度的转变看成一个成长、变化的过程。九年，里面肯定有很多复杂的情况，不要总是老生常谈，不管是夸她勇敢，还是笑她天真。,0
和搞文字狱一样，抠字眼找问题，自以为找到了就要把人拖出来枪决,0
呵说的好像你在场一样，两边都是一面之词就不要全信了吧。乖乖吃瓜不好吗，带着粉丝滤镜说话没必要也没用,0
不想因为网络上一些情绪对不相关的人产生恶感,0
"哈哈哈哈哈哈哈哈哈哈哈哈哈哈哈哈哈哈哈哈哈哈哈哈哈哈哈哈哈哈哈哈哈哈哈哈哈哈哈""你不结婚?全像你这样了，我怎么办。你更欠我的了"",所以啊，很明显婚姻是他们最后坚持的底线了，痛死他们算了",0
从道德层面上讲，荒木从来都是个猥琐的人，但从摄影艺术讲，有些东西是在被逼迫情况下才能表露出来的，这是荒木的摄影哲学之一，他奉献很多，为了自己奉献自己和他人，也造化了摄影艺术,0
"而且我对做实事、实际行动改变一直抱有怀疑，难道发声创造舆论场就是没有意义的么，即使是没有收入的大学生甚至是未成年人也有权利批判啊，不然一旦开始设置门槛的话，这个玩意虚无缥缈没有定数。你能自立了，人家问你你能自立到什么程度呢，能自己买房么；你能买房了，人家问你，你能教育好下一代么,我时常在想，西方式自由文明目前看好像只能建立在物质丰富的基础上，一旦遇到天灾人祸也是两难的。可相对的，我们的物质又似乎永远不够丰富，永远说物质基础不够，然而我的感受是很多人的精神远远追不上物质了，不论什么时候都可以说起码你吃饱饭了。",0
女权这部分内容马克思的学说有涉及,0
为什么扯淡，你觉得空姐可以随便骚扰？扯淡什么？,0
这个我倒是觉得没啥问题，但是以前妇产科那个真的……,0
pgone那唱的 不是节目 你要在网易云听到 10秒就切了  毕竟节目要留着pgone和gai继续炒,0
可怕的是，如果这个案件无法定罪，在男权世界里他并不会遭到道德审判，反而会当作完美脱罪样板被争先效仿！这是法律和道德底线的双重崩塌！,0
我觉得这句话翻译过来就是 我不想相互生厌张口闭口全是怨 我喜欢干净利落我希望抄袭狗死,0
